{"schema_version":"v1","bundle_id":"bundle-1","subject":{"ecosystem":"npm","package_name":"pkg","version":"1.0.0"},"canonical_severity":"high","deterministic_findings":[{"finding_id":"F-1","rule_id":"r","title":"review","canonical_severity":"high","evidence_ids":["E-1"]}],"evidence":[{"evidence_id":"E-1","kind":"readme","path":"README.md","digest":"sha256:example","redacted_text":"bounded redacted text"}],"redaction":{"policy_version":"redaction-v1","redacted_fields":{"email":1},"omitted_evidence_count":0,"max_snippet_bytes":4096},"constraints":{"llm_may_change_severity":false,"llm_may_create_findings":false,"tools_available":[]}}
